"";"url";"date";"title";"body"
"33";"https://www.theguardian.com/world/2018/jan/12/german-coalition-talks-angela-merkel-to-move-on-to-next-stage-after-marathon-session";2018-01-12;"German coalition talks clear first hurdle after marathon session";"Angela Merkel’s CDU and centre-left Social Democrats have reportedly agreed compromises on wide-ranging issues
Leaders of Angela Merkel’s conservative Christian Democratic Union bloc and the centre-left Social Democrats have cleared a first hurdle towards the formation of the next German government after marathon overnight talks.
Merkel, the German chancellor, and the Social Democrats’ (SPD) leader, Martin Schulz, on Friday morning recommended moving on to formal coalition negotiations after agreeing compromises on issues ranging from European integration via healthcare to migration quotas.
“We have realised that the world isn’t waiting for us,” Merkel said at a press conference on Friday morning. “We are convinced that Europe needs a fresh start and have developed the right ideas to go with it.”
“I believe we have reached outstanding results,” Schulz added.
Their optimism comes at the end of a period of rare political uncertainty, prompted by inconclusive federal election results in September. The collapse of talks to form an unorthodox “Jamaica” coalition between the CDU, the FDP and the Green party even led to speculation that Merkel would resign as she faced the prospect of leading a weakened minority government.
German media reported that the breakthrough was reached after Merkel’s conservatives ceded to SPD demands for an equalisation of health-insurance contributions made by employers and employees.
Under Germany’s multipayer healthcare system, employers and employees previously contributed an equal amount towards each person’s statutory sickness fund, but since the system was changed in 2005, people have increasingly had to shoulder additional payments.
In return, reports indicated the Bavarian sister party of Merkel’s CDU had succeeded in its goal to limit the number of family members who can be reunited with refugees that have been granted asylum in Germany.
A 28-page coalition paper, presented by Merkel as a “give-and-take” compromise, suggests family-reunification arrivals should be capped at 1,000 a month, and overall immigration be capped between 180,000 and 220,000 people.
The CSU leader, Horst Seehofer, who provoked Merkel’s ire last week by inviting Hungarian president Viktor Orban to a party gathering in Bavaria, said on Friday he was “very happy” that his initial optimism about the talks had been rewarded.
Christian Democrat and Social Democrat leaders also agreed to lower the tax surcharge, introduced to fund the reunification of east and west Germany, by €10bn (£9bn) by 2021.
The coalition paper states the next German government will be prepared to make higher contributions to the EU budget, as well as support “funds for economic convergence and social convergence and support of structural reforms that can be a starting point for future investment budget for eurozone”.
In a message which will be warmly received by the French president, Emmanuel Macron, Germany’s two large centrist parties stressed the need for more Franco-German cooperation: “The renewal of the EU will only succeed if Germany and France work towards it with all their strength.”
France gets six mentions in the paper, which will become a blueprint for further talks in the coming weeks, compared with three mentions for Turkey, two mentions for the US, one mention each for Russia and China, and no mention at all for the UK.
The French government spokesman, Benjamin Griveaux, welcomed the agreement, describing it as “important for the stability and future of Franco-German relations”.
While the paper emphasises that “Europe has to take its fate into its own hand more than before”, there are no specific targets for future military spending, nor any mention at all of Nato.
In the early stages of exploratory talks this week, it was reported Germany’s would-be coalition partners had agreed to drop plans to lower carbon dioxide emissions by 40% from 1990 levels by 2020.
Without additional measures, Germany will miss its 2020 emissions target, due to better than expected economic growth. The coalition paper foresees the new government drawing up a timetable for phasing out coal power by the end of this year.
Negotiation talks at the SPD headquarters in Berlin on Thursday night were accompanied by noisy protests from both climate change activists and workers in the country’s coal industry.
SPD delegates will vote on whether to move talks to the next stage at a party conference on 21 January. Even then, SPD leaders will still have to sell the coalition to their membership, and will face resistance from many MPs and supporters who believe another coalition with Merkel could prove an existential challenge to their party’s future.
“If Schulz and Seehofer both find the outcome of the talks ‘outstanding’, then at least one of them is wrong,” tweeted Kevin Kühnert, the chairperson of the SPD’s youth wing.
“A proverbial lick of paint, many promises, a lot of kludge,” said Marco Bülow, a leading MP on the left wing of the SPD. “This is not a fresh start, not even a standstill. The past has shown that the [Christian Democratic] Union will prevent progressive plans.”
If the SPD membership votes down the coalition treaty next month, Merkel’s only remaining options will be to form a minority government or to hold new elections.
The Social Democrats had initially ruled out another coalition with Merkel after poor results in the election on 24 September, but reconsidered after her talks with two other parties failed."
"34";"https://www.theguardian.com/world/2018/jan/06/angela-merkel-german-coalition-social-democrats-talks";2018-01-07;"Angela Merkel at bay as Social Democrats to set high coalition price";"German chancellor faces hard talks with centre-left on Sunday to secure fourth term, but rightwingers may cause trouble
Germany’s beleaguered chancellor returned to the negotiating table on Sunday with politicians from the Social Democratic party (SPD) and representatives of her Bavarian sister party, the Christian Social Union (CSU), to stave off the end of “Merkelism” by re-establishing the coalition that governed Germany from 2013 to 2017.
Angela Merkel’s efforts will involve tough bargaining with the centre-left, which eyes control over the country’s well-stocked state coffers as a reward for entering a new coalition – in the knowledge that failure of the talks could spell the end of the Merkel era.
“I think that it can be done. We will work very swiftly and very intensively,” Merkel told journalists as she arrived at the Social Democrats’ headquarters on Sunday.
“I am going into these talks with optimism. At the same time it is clear to me that we will have an enormous piece of work in front of us over the next few days but we are willing to take it on and to bring a good result.”
Following the collapse of talks to form an unorthodox “Jamaica” coalition with the Free Democrats and the Green party in November, a centrist alliance would guarantee the leader of the Christian Democratic Union (CDU) her best chance of a stable government for a fourth term in office.
But historically poor results for both parties at last September’s elections mean that a new “grand coalition” could barely lay claim to such a name, and sliding polls are increasing pressure on the two political tribes to retreat behind orthodox party lines.
The SPD leader, Martin Schulz, who has previously ruled out forming a coalition with Merkel, has to win over a highly sceptical party membership that will get a final vote on whether to enter an alliance with the CDU, and is likely to seek protections for increased social security spending and infrastructure investment.
Key figures in the SPD believe Schulz can only guarantee such promises by laying claim to the previously CDU-run finance ministry. A centre-left finance minister could relax Germany’s balanced budget rules and work to meet French president Emmanuel Macron’s goals for reforming the eurozone.
The previous SPD leader Sigmar Gabriel’s decision to pick the economic and foreign ministries as trophy posts in 2013 is now widely seen within the party as a strategic mistake. But Schulz’s proposals will meet fierce resistance from the conservatives on the other side of the table, many of whom look towards the rightward-lurching government of the new Austrian chancellor, Sebastian Kurz, as a model to emulate.
Former transport minister Alexander Dobrindt called for a 'conservative revolution' against a left-liberal mainstream
Facing state elections in Bavaria in the autumn this year, Merkel’s allies in the CSU in particular have ratcheted up their rhetoric. Politicians from the party have over the past week called for cuts in benefits to refugees, mandatory age tests for asylum seekers, and extending the suspension of Germany’s policy to reunite refugees with their families.
In an comment article for the newspaper Die Welt, former transport minister Alexander Dobrindt called for a “conservative revolution” against a left-liberal mainstream he saw as typified by the culture of Berlin’s Prenzlauer Berg district – a hotbed of dissident culture in 1980s East Germany, now itself a byword for gentrification.
At Friday’s party conference in Seeon-Seebruck in southern Bavaria, the CSU leader, Horst Seehofer, risked antagonising Merkel by inviting the Hungarian prime minister, Viktor Orbán, the European Union’s most vocal critic of the German chancellor’s open-borders stance during the 2015 refugee crisis. The populist leader said on Friday he believed 2018 would be “the year of restoring the will of the people in Europe”.
Merkel, meanwhile, goes into negotiations from one of the weakest positions of her leadership. A survey by the public broadcaster ARD has shown that more Germans prefer fresh elections to a renewal of last term’s grand coalition. A majority (69%) of those polled said Merkel’s party had failed to address concerns caused by the refugee crisis, and her personal approval ratings have dropped since the September elections. However, 53% still say that they would approve of Merkel being the next chancellor, and as many as 93% said she remained a good chancellor.
The 63-year-old has rejected a so-called “KoKo” or “cooperation coalition” option floated by the Social Democrats, which could involve the SPD and the CDU/CSU forming an alliance and agreeing on some issues while leaving trickier points to parliamentary debates.
Shortly before Christmas, the tabloid Bild quoted the senior CDU politician Norbert Lammert as saying that Merkel would step down if talks with the Social Democrats collapsed and there were fresh elections – comments which the former leader of the Bundestag later denied having made.
German media have tipped the Saarland state premier, Annegret Kramp-Karrenbauer, as one of the few successor candidates who would fit Merkel’s mould of pragmatic centrist conservatism. But the CDU politician is relatively unknown even in her own country, and would need a spell in a ministerial post to build up her profile.
One leading German public intellectual has predicted that the next government is unlikely to last a full four-year term, even if Merkel and Schulz manage to come to an agreement in the coming weeks. “We are in a transition phase,” said the political scientist Herfried Münkler in an interview with Die Welt. “Since we are not used to transitional phases – unlike the Italians, for example – the end of Merkelism is a special situation for us, and an exciting one.”
Münkler, who is also a bestselling author of books on global history, said that any political era required a phase of renewal and revitalisation after around 25 years. “We are without doubt in the middle of such a phase,” he declared, “where the decline of a politically leading figure goes hand in hand with significant changes in the surrounding conditions.”
Exploratory talks are expected to last for about a week. On 21 January, SPD delegates will decide at a special party conference whether to start proper talks, which could last until mid-February. The Social Democrats will then allow their membership a vote on whether to enter a coalition with the CDU.
Wrangling over fallout from the European refugee crisis dominated last year’s failed coalition talks with the liberal Free Democratic party and Greens, and is likely to top this year’s negotiations agenda. While the two parties will easily agree to speed up deportations of rejected asylum seekers, Martin Schulz, leader of the centre-left Social Democratic party, rejected conservative proposals to extend the current ban on reuniting refugees with their families, which runs out on 16 March.
The SPD wants wholesale reform of health insurance, equalising the contributions made by employers and employees and unifying the two-tier system of private and public health insurances. Politicians from Merkel’s CDU say the plans would put private health insurers out of business.
Germany’s two big centre parties may find it easier to find common ground on investing in the country’s healthy fiscal surplus in a marquee infrastructure project, such as a state-funded house-building programme to take steam out of the overheating rental market in cities."
"35";"https://www.theguardian.com/world/commentisfree/2018/jan/07/observer-view-european-union-eastern-bloc-hungary-poland";2018-01-07;"The Observer view on the EU’s eastern bloc";"Europe faces a threat to its cohesion. But this time it’s on the eastern front, not the western
European leaders have been at pains over the past 12 months to emphasise that Brexit is not the only or even the biggest issue confronting the EU. They do so, in part, to keep the British in their place. But they also speak the truth. Whether it is eurozone reform, the rise of xenophobic extremism or growing pressure exerted by Russia, Europe has an awful lot on its plate without worrying overmuch about what Boris Johnson wants.
Yet the EU’s biggest challenge in 2018 may be none of the above. It comes from within. It has been slowly emerging along the bloc’s central and eastern flanks since the so-called Visegrád Group of Poland, Hungary, Slovakia and the Czech Republic acceded in 2004. And it has sharpened into all-out confrontation following Brussels’ decision last month to punish the rightwing governments in Warsaw and Budapest for their rejection of migrant quotas and alleged disregard for EU values.
The Observer is the world's oldest Sunday newspaper, founded in 1791. It is published by Guardian News & Media and is editorially independent.
Front and centre in this fight is Viktor Orbán, Hungary’s prime minister, who wears his contempt for the liberal, integrationist European agenda advocated by Emmanuel Macron, France’s president, and Jean-Claude Juncker, the commission president, like a badge of pride. Orbán has called for the defence of Europe’s “Christian culture” against “Muslim invasion”. And he accuses Angela Merkel, Germany’s chancellor, of “moral imperialism” in supposedly forcing Syrian refugees on Europe in 2015.
Orbán’s crude antics have resulted in elevated poll ratings at home, his expected re-election this spring, and a raised profile as the voice of heightened central and eastern European resistance to Franco-German domination of the EU. The prospect of Britain no longer being around to offset the influence of Berlin and Paris has fuelled this reactionary, Eurosceptic dynamic among smaller EU states whose membership London formerly championed – yet another unwelcome Brexit outcome.
Orbán took the fight to Merkel last week, promoting his destructive nationalist-populist, anti-migrant agenda at a conference of the German leader’s CSU coalition partner in Bavaria. By encouraging opposition to Merkel’s approach among her conservative supporters, Orbán could help scupper her last chance of forming a government following 2017’s election reverses. If Merkel falls, a political colossus will have been brought low by relative nonentities, to the lasting disadvantage of a Europe where moderate, commonsense centre-ground politics is eroding.
Orbán now claims a new friend in the almost but not quite neo-fascist coalition that won power in Austria at the close of 2017. But it is Poland, under the ugly tutelage of the authoritarian Law and Justice party, that has emerged as his closest ally. Its government, too, is at legal odds with Brussels. And Poland’s leaders, too, sense a chance to influence the EU’s overall direction of travel. It was Poland’s duty, Jaroslaw Kaczynski, the country’s de facto leader, said last year, to “show the sick Europe of today the path back to health, fundamental values, true freedom and a stronger civilisation based on Christianity”.
Speaking alongside Orbán in Budapest last week, Mateusz Morawiecki, Poland’s prime minister, predicted a “year of great battles” against western Europe’s multicultural and integrationist values. It was time to scrap the EU’s migration policy, which was a “spectacular failure”. But bigger, glittering prizes were in sight. “I believe like-minded nations like ourselves together can influence Europe’s future in a very positive way … We don’t want to live in an empire but rather in an alliance of free nations,” he said. Nigel Farage would be proud.
The biggest punch-up in 2018 is likely to be over the EU’s next seven-year budget, which kicks in from 2021. Poland and Hungary are net beneficiaries. France and Germany are the biggest net contributors, their burden rendered more onerous by Britain’s retreat. Any cutbacks would hurt Warsaw and Budapest more than most, which may be why they are getting their retaliation in first. Nor can the eastern refuseniks count on unquestioning solidarity within Visegrád. Slovakia, a eurozone member, says its EU loyalties outweigh regional alliances.
Germany and the wealthier west European countries are now linking the future allocation of billions of euros in structural funds to improved cooperation from Poland and Hungary. Given the nationalistic, anti-Brussels mood in many smaller member states, such tactics could backfire. The obvious risk is that a big-boys’ crackdown on dissenters, coinciding with a difficult Brexit denouement, could leave the EU struggling for cohesion on both eastern and western fronts. Once again, the dream of a strong, united Europe may be slipping away."
"36";"https://www.theguardian.com/commentisfree/2018/jan/04/angela-merkel-chancellor-far-right-voters";2018-01-04;"Why the once-durable Merkel may not last much longer";"The chancellor’s need to win back far-right voters is hard to square with her previous embrace of open borders
Angela Merkel’s New Year address on German television has acquired all the familiarity of the Queen’s Christmas speech. So much so that one newspaper ran a front page showing the chancellor’s 12 years in shiny-jacket attire under the headline, “Can the Social Democrats put up with another one of these?”
The needling of the centre-left Social Democrats (SPD), for preparing to support Merkel’s fourth term in office, highlights a more irreverent tone towards “Mutti”, as she restarts stalled talks to hammer out a new coalition.
The chancellor has been attacked by some of her own former supporters for her unwillingness to be more open about the practical implications of absorbing the 2015 wave of refugees, and for allegedly failing to identify warmly enough with the victims of the Christmas terror attack in Berlin in 2016. In other words, she is being treated like any other long-stay politician showing signs of fatigue. On a road trip through Germany I heard grumbles and frustration about a chancellor who only a year ago was hailed as virtually superhuman.
It is no longer absurd to suggest Theresa May could outlast the German leader in office
It is now just over three months since an election which saw Merkel and her SPD rivals punished at the polls, a sharp rise in support for the far right, and votes scattered liberally across smaller protest parties, from the free-market liberals in the FDP to the Greens and leftwingers Die Linke. The public is wearying of coalition talks that have failed to yield either a “Jamaica” coalition of the Christian Democrats, the FDP and the Greens, or (so far) a grand coalition of the Christian Democrats and SPD.
Merkel’s ability to choose a coalition deal that suits her is less powerful than it was. For the first time, her message to the SPD – “the world won’t wait for us” – was part chiding, part imploring. The party, in turn, is hamstrung by leader Martin Schulz, who took them down to a mere fifth of the vote, and foolishly promised after the election not to re-enter a Merkel-led coalition.
Together with Tilo Jung, a video blogger, I hit the autobahns from Berlin into Mecklenburg in the old East – close to the wastelands where Merkel grew up. As a journalist, I covered Germany’s reunification and believe Merkel helped define the positive tone and stability of Germany after 1990. Tilo, by contrast, is impatient with her technocratic language and fudging of awkward choices. Conversely, he is keenest on Merkel because of her response to refugees. I admire the values that led her to act as she did, but fret that, like many liberals now, she is less good at addressing the difficult questions that arise from immigration (whether through open borders or single-handed refugee largesse).
Many insights that struck me came from encounters with Germans beyond the country’s serene self presentation in Berlin – like the Mecklenburg workers we met who worried about low wage levels, and a young couple commuting huge distances to find higher salaries in the old West. We encountered a successful middle-aged voter for the far-right Alternative für Deutschland who had previously been a Merkel loyalist. How she intends to win back such voters (the AfD has high levels of popularity among the under-44s), while remaining true to the spirit of her commitment to open borders in 2015, is a mystery.
The popularity of the small and insurgent parties is causing headaches on the centre-left, as well as the centre-right. Manuela Schwesig, a Mecklenburg SPD politician, talks in forthright language about the failings of coalition politics. One nascent organisation, SPD Plus Plus, is calling for a fresh start and a bigger voice for the grassroots.
For all the barnacles that now attach to her leadership, Merkel will not shrivel as a political force in 2018. Only she has the votes and personal heft to bring together a government. But the strains of the coalition will be intense, and her leadership will be more fraught than ever. It will rely on her rightwing Bavarian sister party, which will demand a larger say in economic matters, with the SPD less inclined to sign up to another round of Merkelism just for a seat at the cabinet table. Her toughening of tone on migrant checks and removal of failed asylum seekers risks appearing erratic.
It is no longer absurd to suggest Theresa May could outlast Merkel in office. So the task for Germany’s durable leader will be to decide more precisely what her chancellorship should represent at home, as well as on the European stage.
Germany’s politics is no longer the stuff of soporific speeches and a supine parliament – the shift reflects a more fragmented society and a more assertive electorate. Merkel will need to either use her wiles to rise to a new German reality, or begin to make way for the post-Mutti era.
• Anne McElvoy is a senior editor at the Economist. Her BBC Radio 4 documentary, Germany Without Merkel, is on iPlayer"
