"";"url";"date";"title";"body"
"42";"https://www.theguardian.com/world/2017/dec/01/germanys-spd-denies-agreeing-coalition-talks-angela-merkel-martin-schulz";2017-12-01;"Germany's SPD denies agreeing coalition talks with Angela Merkel";"Leader Martin Schulz says reports are ‘plainly and simply’ wrong but that his party will continue to explore all options
The leader of Germany’s Social Democratic party has denied reports that he has green-lighted talks about another “grand coalition” with Angela Merkel’s Christian Democrats.
“The reports are plainly and simply wrong,” the SPD leader, Martin Schulz, said on Friday after claims in the German newspaper Bild that the two parties had agreed to begin exploratory talks on a new coalition following a meeting with the German president, Frank-Walter Steinmeier, on Thursday.
The newspaper said the participants – Merkel, her Bavarian ally Horst Seehofer and Schulz – had discussed various options for forming a government, including a grand coalition, setting up a minority government under Merkel, or holding new elections. But they ultimately agreed to start talks about a rerun of the conservative coalition.
Merkel is casting around for a coalition partner after her centre-right bloc shed support to the far right in the 24 September election. Her attempts to form a three-way tie-up with the pro-business Free Democratic party (FDP) and the Greens failed.
Schulz insisted his party would continue to talk about all options, which could include tolerating a Merkel minority government, possibly in tandem with the Green party. He added that he had called the chancellor to complain about “inacceptable” leaks to the press.
Whether the SPD is prepared to go all the way towards a coalition agreement with Merkel remains unclear. Schulz fronts a party which is split evenly down the middle on what he should do next.
“We need big ideas for our country,” said Manuela Schwesig, the state premier of Mecklenburg-Vorpommern and a former family minister. “As before, I remain sceptical that you can do that by carrying on ‘business as usual’ in a grand coalition.”
The youth branch of the SPD is organising a petition which rejects a third grand coalition under Merkel and advocates that the centre-left should tolerate a Christian Democrat minority government instead. “We remain clear: the SPD’s rejection of a continued grand coalition was mandatory and right,” says the petition."
"43";"https://www.theguardian.com/commentisfree/2017/nov/27/the-german-left-should-demand-a-high-price-to-prop-up-merkel";2017-11-27;"The German left should demand a high price to prop up Merkel";"The chancellor is endangered by the sudden rise of the far right – but the German electorate needs options beyond continuity or neofascism
If I was a cow being led to an abattoir and the boss offered me a stake in the business, the first question I would ask is: are you going to stop killing us? Sadly, this was not the first question the leader of Germany’s Social Democratic party (SPD), Martin Schulz, asked after Frank-Walter Steinmeier, the president of Germany, made a “dramatic appeal” for the centre-left party to join Angela Merkel’s Christian Democrats in a grand coalition. Instead, the answer was: “Let me consult my colleagues.”
If, as is likely, the SPD’s membership tells Schulz to rejoin Merkel to stabilise Germany, the only prediction one can make is that the price they demand to save her bacon will not be high.
At the core of the crisis are the 94 MPs elected to the Bundestag from the far-right Alternative für Deutschland (AfD) – which has come from nowhere to be the third largest party. So far, they have used their platform to demand Syrian refugees be sent home, and to ostentatiously show support for the German military, which, for historically obvious reasons, is kept out of parliamentary politics. The Bundestag platform, from which extreme language has been absent since the Federal Republic’s foundation, is now a megaphone for the AfD’s racism and Islamophobia.
If coalition talks go nowhere and Merkel has to go for new elections, it would be enough for the AfD to deliver the same result again to cement its position as the revolutionary force in German politics. It would also confirm something no friend of Germany wants to say, but which has to be said: that disconcertingly large numbers of Germans are prone to the modern equivalent of fascism.
A system designed after 1945 to guarantee a two-party centrist consensus has failed to do so. While both the Greens and the radical left Die Linke were successfully absorbed into the parliamentary system, stabilising at between 6% and 10%, the AfD burst through at the first opportunity to score 14% – and this in a country boasting record low unemployment and high levels of social welfare. And many believe the AfD would do even better in new elections.
In the east-central state of Thuringia, where the AfD scored up to 27% in some districts, the leftists and social democrats I met last month were worried. It is not just, or even mainly, the poverty of the old East Germany that has driven people there towards the right: it is resistance to change. The AfD’s base here is middle-class, driven by resistance to migration, to modernisation, to the gradual encroachment of global brands on to suburban Germany’s folksy high streets, and, above all, to further European integration.
The AfD is not classically fascist – and does not need to be. Hitler needed his stormtroopers to take on and defeat the most organised labour movement, and biggest communist party, in Europe – and he did so amid double-digit unemployment. But to construct the essential alliance between the “elite and the mob” – as Hannah Arendt described it – the AfD just needs to go on normalising hate-speech, recruiting well-heeled people from business and the military, and disrupting the status quo.
The centrist Germany of the university campus, the gentrified suburb and the technocratic workplace veers between complacency and fear. Most people I talk to start out saying: “It will all be OK,” and, after a few beers, admit the stomach-clenching possibility that it will not. Berlin, above all, is a city where every old building resonates, if you Google diligently enough, with bad historical vibes; where enough of the past survives to know that in these rooms and on the stairways of now-trendified blocks of flats, the most unspeakable crimes of the 20th century were perpetrated.
So, what should Schulz do? As the price for a new grand coalition, he must demand that Merkel’s party commits to a programme of deficit-led growth, a huge investment programme, an end to the offshoring of industrial jobs to eastern Europe and re-engagement with Emmanuel Macron’s plan for European integration. Germany should end its rearguard actions against expansionary monetary policy in Europe and coordinate a fiscal stimulus to the eurozone periphery on the scale of a Marshall plan. That would be worth propping up Merkel for, but nothing else.
One of the biggest problems with the rest of the G7’s engagement with Germany has been the refusal to acknowledge a problem with the elites that is well known to the German left: their attachment to a rules-based idea of freedom combined with a tendency to make romantic gestures when the rules don’t work. Merkel’s response to the refugee crisis of 2015, and indeed her attempt to expel Greece from the eurozone in the same year, both exemplify a level of unpredictability that the rest of Europe has been too polite to mention.
Although the last time Germany failed to form a government was in the Weimar republic, the parallels here are not with the 1920s. Instead, they are with Austria in 2017. Austrian voters handed victory to a rightwing nationalist conservative demagogue, who is trying to patch up a coalition with the far right. If the German socialists can’t get Merkel to engage with their policy, they should stay out of coalition with her party. If Merkel can envisage forming a minority government, so could the SPD, with the support of the Greens and the radical left. In all three parties, those with imagination should be laying the basis now for a red-red-green coalition that ends neoliberal economics in Germany.
The German electorate needs more cards on the table than continuity v rightwing revolution. The only thing that’s going to bury the AfD is an alternative for the people, for internationalism, for the active embrace of multicultural values and refugee support – and for social justice."
"44";"https://www.theguardian.com/commentisfree/2017/nov/26/only-one-sick-country-europe-britain-germany-merkel-hung-parliament";2017-11-26;"There’s only one sick country in Europe – and it’s not Germany";"NA
Suddenly Germany, famed for its political stability, betrayed a new vulnerability last week. Or so some would have you believe. One of the tragedies of modern Britain is the implosion of the political centre. And without the ballast of a strong centre, we are steadily losing the capacity to think straight.
This was a case in point. Chancellor Merkel’s attempts to build a coalition government fell apart. Eurosceptic liberals and green ultras could not agree a programme for government with her Christian Democrats. The British right gloated at the prospect: this was the moment to exact better terms in the Brexit negotiations from a mortally wounded Germany now suddenly brought to earth.
It was thinking far removed from any reality. Germany is neither politically nor economically mortally wounded. Yes, there is a major political crisis following a hung election, but Germany will find a way through, rather more satisfactorily than stuffing a tiny minority party with a billion-pound bribe, as the Tories did with the Democratic Unionists. Its political system requires its principal parties to keep on talking to each other if none can command an overall parliamentary majority; they have their ideologies, but tempered by the necessity of dialogue to form a potential programme for government. A resolution will be found, or another election called, with the electorate more keenly aware of the choices they are making. It is democracy by grownups.
That is what is happening. German Social Democrats, after an impassioned plea by the president to put public before party interest, will poll their members about the terms for creating a possible coalition with Merkel’s Christian Democrats. There will be enormous wariness: junior partners in coalitions don’t fare well in either Germany or Britain, but Merkel will be going cap in hand to her left-of-centre rivals as her last option. For them, it could be the opportunity to put the social firmly back in Germany’s social market economy.
The economic backdrop to the negotiations could scarcely be more benign. Germany is beginning to grow strongly. Meanwhile, the eurozone, derided in Britain for its sclerosis, austerity, social cruelty, unsustainability and imminent collapse, is growing at the fastest rate for 10 years. German unemployment is lower than in Britain, and not achieved by many of those in work suffering stagnating real wages and insecurity. Germany has a strong budgetary surplus; there is huge scope to increase its already formidable economic competitiveness by stepping up its spending across new technology. It is not Britain that is going to be at the centre of the latest European industrial revolution, but Germany and France.
Yet none of this intrudes into our insular political debate. Germany is not about to capitulate to British demands to be cut a special deal on Brexit so that we can enjoy all the trade and market access benefits of EU membership without any of the responsibilities. Why would any German politician want that? Why would they need to? We are the supplicant country in desperate and growing trouble, if only we could see it.
That was the message of last week’s budget. The Office for Budget Responsibility projects that economic growth over the next five years will average 1.4%, an unprecedented, brutal downward revision of its forecasts. Productivity is projected to grow at a snail’s pace, so there is virtually no growth in earnings adjusted for inflation. It is the bleakest official forecast I can remember.
Nor does it capture all the risks. Sir Ivan Rogers, UK representative to the EU between 2013 and 2017 – in his lecture at the Hertford College series on prime ministers and Europe on Friday evening (full disclosure: I am Principal at Hertford, Oxford) – predicted the only feasible Brexit trade deal would be one based in principle on the Canadian free trade agreement, but which could take up to a decade to negotiate in legal detail. This, along with the absence of other trade agreements, which will take equally long to negotiate, would represent such a shock to British trade flows that he thought it would topple the UK into a full-blown recession. As shocking was his revelation that some leading Brexiters were fully aware of the economic risks, but wanted to organise the pain so it comes early rather than later in the run-up to a 2022 general election.
The chancellor, Philip Hammond, one of the few remaining substantial centrist British political figures, knows all this. But to acknowledge it openly would, given the current state of the Conservative party, cost him his political life. He would be confirmed as the pessimistic, unpatriotic Eeyore working against the will of the people. Instead, he has to talk of the opportunity ahead, and how the performance of the UK economy “continues to confound those who seek to talk it down”. It is rubbish, as well he knows. But the atmosphere does not permit the truth to be said. Britain remains the exceptional country that is going to get an exceptional deal congruent with its exceptional destiny.
British exceptionalism is a national delusion, and a shaft of light is that it is gradually being dispelled. Our economic performance is woeful, to be cruelly exposed when outside the EU. And there is an emerging consensus about the need for an industrial strategy both to support more fast-growing, knowledge-intensive firms and to try to close Britain’s huge geographical inequalities.
Milton Keynes, with half Liverpool’s population, produces the same volume of goods and services. For all its political weakness, the government is set to launch an industrial strategy white paper tomorrow – reinforced by Hammond earmarking another £2.3bn for research and development in 2021 and £7bn for the productivity fund in 2022. Jam tomorrow, maybe, and years behind what is happening in Europe and China, but a welcome signal of a new direction of travel.
It is the beginning of thinking straighter, but too many cling to Britain’s alleged exceptionalism, firing up so many Brexiters. The question in British politics is how soon the economic severity of what lies ahead will change minds – and whether exceptionalism can survive 20 years of wage stagnation, recession, stasis and the inevitable setback in house prices. It is not Germany that is the sick man of Europe, the cherished belief of the Brexiters, but Britain. Real change, even recommitting to Europe, will follow that growing realisation."
"45";"https://www.theguardian.com/world/2017/nov/25/germany-return-weimar-angela-merkel-bundestag-coalition";2017-11-25;"Echoes of the Weimar Republic as German politicians lose knack of coalition-building";"NA
Danyal Bayaz has experienced many things during his first few weeks as a new MP, but boredom is not one of them. Two months after entering Germany’s parliament as a Green party candidate, Bayaz, 34, from Heidelberg, has watched rightwing politicians give each other standing ovations for Eurosceptic diatribes, leftwingers heckle the far right as racists and a former climate activist with dyed hair form unlikely alliances with Christian Democrats in tailored suits.
Last week Bayaz saw the dramatic collapse of coalition talks that would have seen his Green colleagues catapulted into government and now faces the possibility that his seat may come up for grabs again in fresh elections next spring. “Right now I am not even sure if it’s worth me getting a loyalty card here,” he quips as he orders a cappuccino in the Bundestag’s canteen.
For years, German politics were both mocked and admired for being too uneventful to the point of tedium. Only recently the lack of drama inside the reconstructed Reichstag’s circular plenary chamber led to calls for a more confrontational, Westminster-style approach. But as old geopolitical certainties have crumbled over the past 18 months, Berlin’s consensual, unexcitable style of policymaking has won new admirers.
The collapse of talks to form the next coalition government have exposed Angela Merkel’s diminished authority. Many are now beginning to wonder if the division wrought on Britain and the US by Brexit and Donald Trump has also descended on Europe’s biggest economy.
With Merkel’s last coalition partners, the Social Democratic party (SPD) and the Free Democrats (FDP), more eager on parliamentary opposition than on government posts, and an already ultra-oppositional Alternative für Deutschland hoping to receive a further boost from the political standstill, commentators in Germany have started to evoke the darkest days of the Weimar Republic, when short-lived minority governments ruled by emergency decrees.
“Like in Weimar, the federal republic is now a multiparty system in which extreme parties have begun to paralyse the working of the parliamentary democracy,” wrote Stephen Szabo, an expert on US-German relations.
Right now I am not even sure if it’s worth me getting a loyalty card in the Bundestag canteen
“Germany’s obsession with stability was largely a result of reforms aimed at avoiding the mistakes of the Weimar Republic,” said Anthony Glees, a historian at the University of Buckingham. “In spite of a proportional vote system, a 5% threshold for smaller parties guaranteed that postwar Germany was for decades a two-party state, where the power would lie safely in the centre.”
With polls for possible fresh elections next year predicting that both Merkel’s Christian Democratic Union and the SDP could drop below 30% while support for the FDP, the AfD, the Greens and the Left party continues to grow, Glees said, “that system is now biting Germany in the leg”.
Many historians warn of hastily drawn comparisons, however. “What’s wrong with Germany becoming more like multiparty democracies in the Netherlands or Scandinavia?” asked Andreas Schulz, a researcher on the history of German parliamentarianism.
Merkel has announced she is sceptical about forming a minority government, either on her own or with the Green party, which would have to form majorities with other parties vote by vote. But Schulz said the traumatic experience of seeing minority governments collapse and allow the rise of Adolf Hitler obscured the fact that minority governments worked efficiently elsewhere in Europe and even at a German state level. As the centre-left SPD is waking up to the potential cost of new elections and mulls over tolerating a minority government, it is possible that Merkel could eventually come to agree.
“The way the Bundestag had managed to integrate first the Green party in the 1980s and then the Left party at the start of the new millennium shows that our parliamentary system can adapt to new parties,” Schulz said.
“We sometimes forget that the Weimar Republic only had 10 years to mature and develop,” said Thomas Mergel, a historian at Berlin’s Humboldt University. Even during its short existence it had shown that a parliamentary system could teach the most intransigent political party the value of coalition forming, he argued.
In the 1920s and 30s, parliamentarians started to lose the ability to find compromises only once the Great Depression wreaked havoc with the German economy. New parliamentarians such as Bayaz are concerned that Germany’s new populist right could be quicker at learning to exploit the polarised political landscape than established parties.
The last week has seen delegates of anti-immigration AfD take their seats in parliament wearing yellow ribbons on their suit jackets, in what the party described a gesture of solidarity with Germany’s armed forces. On Twitter, AfD MPs claimed that the “old parties” had left their seats half vacant during a debate on the military – a claim which was later disputed.
Another debate saw conservatives, liberals, environmentalists and leftwingers join forces to oppose an AfD suggestion that Syrian refugees should be sent back to their homeland since Islamic State had “almost been beaten” and security levels “substantially improved” in the country. The motion was soundly defeated, but the rightwing newcomers had found their stage.
Bayaz is nevertheless optimistic that a livelier Bundestag can have its upsides. “There is a new pluralism in the debating chamber,” he said. “Parties are not as easy to keep apart as they used to be.”
The son of a German mother and a Turkish father with a PhD on financial markets, Bayaz said he would have enjoyed a conservative-liberal-green “Jamaica” coalition that cut through old political certainties. With his smart navy suit and short hair, he has in his first weeks already been mistaken by the press for a member of the FDP and drawn confused looks from the rightwing populists. It is not impossible to conceive that newcomers like Bayaz could end up ushering in a German minority government after all.
One of the hangovers of the Weimar Republic is that a president cannot call a snap election without making parliament vote in a chancellor first. The assumption is that a chancellor Merkel, who has not organised a governing coalition, would fail to gain a majority in such a vote. New MPs who have only just started to find a taste for their life in politics, from whatever party, may have a different idea.
Born amid the chaos following the first world war, the Weimar Republic lasted, unofficially, from 1919 to 1933 and struggled to cope with extremism, hyperinflation and resentment at Germany’s treatment by the war’s victors. In order to reduce political conflicts, a proportional representation system was adopted, leading to a series of coalitions that struggled to govern. Political violence was endemic. By 1923, there had been 376 political assassinations. US loans helped recovery from 1924 to 1929, but the Wall Street crash led to recall of the loans and the start of a new economic crisis, rising unemployment and dissatisfaction with mainstream parties. In January 1933 the president, Paul von Hindenburg, appointed Nazi party leader Adolf Hitler chancellor. That year, after the Reichstag fire, Hitler seized absolute power and Germany became a fascist dictatorship."
