"";"url";"date";"title";"body"
"17";"https://www.theguardian.com/world/2018/feb/11/merkel-defends-painful-compromises-that-kept-her-in-power";2018-02-11;"Angela Merkel defends 'painful' compromises that kept her in power";"German chancellor denies her authority is on the wane after concessions made to coalition partner
Angela Merkel has defended “painful” concessions she made to the Social Democrats (SPD) to win a fourth term as German chancellor and said criticism from conservatives was not a sign her authority was waning.
Asked whether she was planning to groom a successor to lead the Christian Democrats (CDU) in the next election, Merkel said she wanted a younger generation from her party to fill ministerial posts in a renewed coalition with the SPD.
In an interview with the ZDF public broadcaster, she commented on the rising displeasure among conservatives about her decision to give the SPD the powerful finance ministry. “I understand the disappointment,” said Merkel, who has led Germany for the past 12 years. “And now we need to show that we can start with a new team. We have six ministerial posts to fill and, from my point of view, we need to ensure that not only the over-60s are considered but also younger people.”
Merkel was weakened in a September election in which her conservative bloc bled support to a far-right party thrust into parliament for the first time by voters angry at her decision in 2015 to welcome more than a million immigrants.
In November, her efforts to form a government with two smaller parties failed, leaving the country in political deadlock and prompting some members of her CDU party to demand a succession plan.
Last week, she secured a deal with the SPD to renew a right-left alliance that has ruled Germany since 2013 after making painful concessions on Europe and fiscal policy as well as ceding the finance ministry.
The coalition agreement has been criticised by some conservatives who feel the next government will have an SPD-stamped agenda. The SPD’s 464,000 members have to ratify the four-year government programme in a postal ballot and the results will be announced on 4 March.
Merkel said that if they rejected the deal, Germany would probably hold a new general election. She rejected a suggestion that generous concessions to the SPD had weakened her position in the CDU, saying she had decided to cut a deal for the sake of Germany.
She sought to allay fears among conservatives that, by ceding the finance ministry, the next government would stray from the strict fiscal discipline enforced by the former finance minister Wolfgang Schäuble. “It was a very conscious decision at one point [during negotiations] to say ‘yes’ this works, even though I know and I myself felt it was painful,” Merkel said. “I want to say that the we [the conservatives] have also approved the policies [in the agreement] and the finance minister cannot simply do as he likes.”
Some conservatives are unhappy with her decision to allow the SPD to spend a record budget surplus and to embrace their demands for European reform.
The SPD has criticised the “forced austerity” inflicted by Schäuble on southern European countries such as Greece and had vowed in the election campaign to boost investment.
Social Democrat Olaf Scholz, who is expected to become finance minister, said on Saturday that Germany should not dictate economic policies to its eurozone partners and that mistakes had been made in the past. He said that the SPD supported sound finances and would preserve Schäuble’s balanced budget policy."
"18";"https://www.theguardian.com/world/2018/feb/10/germany-politics-kevin-kuhnert-student-angela-merkel-spd-grand-coalition";2018-02-10;"A student called Kevin holds the fate of the Merkel coalition";"NA
He has been described as the babyface politician who holds Angela Merkel’s future in his hands. Some describe him as a “kamikaze” social democrat; others the biggest political talent since Gerhard Schröder.
Kevin Kühnert, a 28-year-old student from Berlin who heads the youth wing of the Social Democrats, is the most talked-about politician in Germany. If he succeeds in his plan to scotch the idea of a Grand Coalition, the fragile construct agreed on last week by Merkel’s conservatives and the left-of-centre SPD, he will simply be the man who turned German politics upside down.
Although presented to the public last Wednesday more or less as a foregone conclusion, the Grand Coalition deal is far from done. Over the next few weeks, the drama surrounding Germany’s most drawn-out coalition talks is set to continue as the SPD’s 464,000 members are invited to vote on the so-called GroKo. Kühnert is the leading face of the #NoGroKo movement, on a mission to prevent what he thinks would be a disaster for both his party and for German democracy. If he succeeds he would make history and potentially bring Merkel’s 12-year reign as Europe’s longest-serving leader crashing down.
“I believe for the SPD to enter yet another coalition with the conservatives [having been in one for eight of the past 12 years] would be very dangerous,” he said in an exclusive interview a day after the putative deal was announced. Merkel ceded key ministry posts to the SPD – including finance, foreign and labour – following marathon talks, and members of the SPD leadership, including its then chief, Martin Schulz, were ecstatic. But not Kühnert, who had earlier tweeted he was “aghast” at the outcome.
“Of course, finance is an absolutely key post in any cabinet,” he said. “But, at the end of the day, the chancellor is still a Christian Democrat and no decision she doesn’t want will get past her or her ministers.”
He accused the SPD negotiators, including Schulz, and his successor as party leader, Andrea Nahles, of being “far too timid in their demands” and not pushing for any truly leftwing policies, such as reducing the taxes of the lower paid and increasing those of the rich. A finance minister, even if he were from the SPD, would fail to push through any of the party’s key principles, he argued. “At the end of the day, it’ll be a Social Democratic finance minister who will be responsible for the fact that the gap between the poor and rich in Germany is only going to get wider because the issue of taxes was barely discussed during the negotiations.”
Kühnert burst on to the political stage following the collapse of the so-called Jamaica coalition talks last month, when the Greens, pro-business Free Democrats (FDP) and Merkel’s conservative CDU-CSU alliance abandoned the idea of forming a coalition. Initially determined that the party, having polled a historical low of 20.5%, could only find its place in opposition, Schulz about-turned and said the SPD was up for negotiations after all.
“We were adamant we didn’t have the mandate to go into government again,” Kühnert said. “Consider too that the coalition as a whole had lost 14% support. The SPD received a lot of recognition when we said we see our role in the next four years as being in opposition. Now I’m afraid that analysis appears to be passé, and I think that’s a huge mistake.”
He is also furious about a lot else when we meet, including the fact that Horst Seehofer of the Christian Social Union, sister party to Merkel’s Christian Democrats, and a staunch opponent to her controversial refugee policies, is set to become interior minister with greater responsibilities. Seehofer calls Hungary’s autocratic leader Viktor Orbán a “friend” and has invited him to speak at party events. “Such a person cannot possibly be the SPD’s political partner,” said Kühnert. “It’s a gruesome concept”. He would simply like to see his party renew itself in opposition.
Sitting in the party’s headquarters, surrounded by portraits of the SPD’s most famous leaders, including Helmut Schmidt and Willy Brandt, Kühnert is aware he is now considered a future leader of the SPD. He also carries an awareness of his party’s historical obligations – Otto Wels, the SPD leader who stood up to the Nazis in a speech to parliament in 1933, is among the portraits – which is why he believes the SPD should be sitting as the main opposition in the Bundestag, rather than the far-right Alternative für Deutschland.
“We have warned against leaving the opposition leadership to the AfD,” he said. “I believe the SPD, in particular, has a historical responsibility not to let that happen.” Last week the SPD saw itself slip down the poll rankings further to 17%, only marginally above the AfD’s 15%. “I fear it’ll only get worse,” Kühnert said.
Last month, at a special party conference in Bonn, at which around 600 SPD delegates narrowly voted in favour of proceeding with the GroKo talks, Kühnert gave a speech stating that anything the CDU and SPD once had in common had been exhausted. “If we were a pub, you might say the CDU is putting its beers on our tab,” he said, coining a phrase which has since been quoted everywhere.
Since the Bonn conference, 25,000 new members have joined the party to enable them to vote, most of them presumed to wish to call time on CDU relations. “We have been inundated with mails and tweets and messages of support from people wanting to help us out,” Kühnert said. “The rise in membership is phenomenal.”
He admits that he greeted Schulz, the former European parliament president, when he was voted the party leader a year ago with 100% support. “I was electrified by the thought that the SPD could become an independent political force again,” he said. That hope was dashed by the election results.
Now, rather than the Schulz Effekt, it is the Kühnert Effekt that everyone talks about. He agrees that, for a party seeking to redefine itself, the rise of Jeremy Corbyn’s Labour has been an inspiration, even more so the performance of Bernie Sanders in the US presidential race. “They have served to prove that social democracy is not a lost cause,” he said.
Regardless of what happens on 4 March, when the results of the postal vote will be announced, Kühnert’s star is unlikely to wane soon. Looking younger than his years, he has a penchant for black-hooded parkas and watching football and curling. A staple on chat shows, he cannot walk down the street without someone asking for a selfie with the man determined to say no to Merkel.
Kevin Kühnert is credited not only with putting the wind up Angela Merkel, but also with rehabilitating the name Kevin, which has a reputation in Germany of belonging to less able children and uncultivated parents.
His parents named him after footballer Kevin Keegan, who played for Hamburg SV between 1977 and 1980. Thousands of Germans have been named after him. But the real Kevin wave came a year after Kühnert’s birth, after the release of the 1990 US film Home Alone – in German Kevin: Allein zu Haus – in which Macaulay Culkin plays Kevin McCallister. Kevin Costner’s fame added to the hype in the 1990s.
A Berlin duo released the song Kevins: “You know things are on the up when we get our first chancellor called Kevin.”"
"19";"https://www.theguardian.com/commentisfree/2018/feb/08/germany-coalition-europe-brexit-martin-schulz";2018-02-08;"Germany’s new coalition comes with risks for Europe – and Brexit";"NA
So Germany has almost got a new government. “Almost”, because a referendum among the members of the Social Democratic party (SPD) could still derail the Groko, the Grosse Koalition with chancellor Angela Merkel’s Christian Democrats (CDU) and their Bavarian sister party, the CSU. And don’t bank on that not happening. Politics used to be top-down thing in Germany. Not any more.
Having said that, the Social Democrats would have to be stupid to refuse the deal. Consider this: in last September’s general election, they went down to historical defeat. As of writing, they are polling a risible 18% or so, not much more than the far-right newcomer Alternative für Deutschland (AfD).
Now you can argue that this is precisely because the SPD has been in government for so long – since 1998, with a break of only four years between 2009 and 2013 – and that a spell in opposition would do it good. And this is what the SPD’s youth organisation wants. They gaze with envy at Jeremy Corbyn’s populist appeal and dream of a rejuvenated party with a hard-left approach winning big in 2021 or 2025 and giving them lots of career opportunities, maybe in a coalition with the Greens and the radical Left party.
If I were a budding career politician in the SPD, I might think the same way. But for the present middle-aged leadership, four to eight years in opposition watching the rise of a new generation is hardly an attractive option. And there is no guarantee that moving to the left will do the SPD any good. That ground is already occupied by the Left party.
What’s more, the SPD’s soon to be ex-leader Martin Schulz has managed to snatch victory from the jaws of defeat (and from his own fit of pique on election night when he vowed that the party would go into opposition). The new coalition agreement has a decidedly social-democratic flavour. And the SPD gets the treasury, which Merkel’s tight-fisted henchman Wolfgang Schäuble used to scuttle ambitious plans in Germany and to throttle Europe in the name of financial discipline. They’re breaking out the champagne in the Élysée and the Berlaymont.
The loser in the poker game is Merkel. The only party that honestly wanted to govern with her were the Greens
Indeed, the loser in the poker game of the past weeks and months is Merkel. The only party that honestly wanted to govern with her were the Greens. The liberal Free Democrats (FDP) walked out of negotiations, and the SPD had to be enticed back with a deal that leaves Merkel’s own party without a single key ministry. Horst Seehofer, who is being forced out of his office as prime minister of Bavaria by his own party, the CSU, is being rewarded for his constant sniping at Merkel’s refugee policy with the thankless job of interior minister, where he can take responsibility for future terror attacks.
Everyone expects the chancellor to leave in the middle of her term and hand over to a successor. As the leader of a so-called Jamaica coalition between the Christian Democrats, the FDP and the Greens, she might have gained a new lease of life. As the leader of her third Groko, she looks tired. The concessions she has made to the SPD give superficial credence to the claims of the AfD that it is the only truly conservative force in the country and that it has stepped into the shoes abandoned by the CDU under Merkel.
This isn’t true. The populist AfD is anti-globalist, Eurosceptic and Russophile, all of which the CDU never was. But if the AfD can avoid further self-radicalisation, scandals and personal vendettas (which doesn’t seem likely), it might be able to break the current mould of German politics and form a coalition with a post-Merkel CDU/CSU, which is sure to tack to the right. Think the Austrian model: 2021 could see a revitalised right re-energising the moribund left, and a return to what the Germans call “Lagerpolitik”, the politics of opposing ideological camps. Not necessarily the worst thing that could happen, by the way.
For the moment, however, and assuming the SPD referendum doesn’t chuck a spanner in the works, it’s Merkel and the Groko. What does this mean for Europe and Britain? Martin Schulz will be foreign minister. As ex-president of the European parliament he is as Europhile as they come. Indeed, he recently proposed aiming for the “United States of Europe” by 2025. These are not empty words. Schulz is an idealist, and this is probably his last chance at real politics. Emmanuel Macron could not have a more fervent – and impatient – ally. So expect to see the euro area become more integrated, possibly with its own finance minister and minister for economic development. Expect more funds to assist the ailing economies in the south, maybe eurobonds or similar forms of debt mutualisation.
Given the resistance of the Visegrad group – Poland, Hungary, Slovakia and the Czech Republic – to further European integration, Schulz could see himself faced with a serious European split within months of taking office. But don’t expect him to give up on his integrationist ideas or to soften his stance on Brexit.
He believes that restarting the German-French “motor” and reviving the eurozone will exert a pull on the peoples of the Visegrad states, who will, sooner or later, throw out their nationalist governments. And if not, he wants Brexit to prove to the pesky Hungarians, Poles, Slovaks and Czechs that leaving the EU is not a cosy option.
So, does the same old coalition mean more of the same old politics? I doubt it. Things are hotting up.
• Alan Posener is a correspondent and commentator for Die Welt and Welt am Sonntag in Berlin and one of Germany’s most influential bloggers"
"20";"https://www.theguardian.com/world/2018/feb/07/germany-coalition-deal-cdu-spd-angela-merkel-martin-schulz";2018-02-07;"Merkel's party loses key ministries in coalition deal";"Junior SPD party is expected to fill finance, foreign and labour ministries under agreement
Angela Merkel has taken a crucial step towards ending a four-month period of political uncertainty by reaching a coalition agreement with the centre-left Social Democrats – but at the cost of giving the party a greater role in government.
Following a marathon of all-night dealmaking sessions and several missed deadlines, Merkel’s Christian Democratic Union on Wednesday agreed on the terms of a fresh deal with the SPD, whose supporters will now get a final say on the agreement through a membership vote.
But the prize of a renewed “grand coalition” is likely to come at the cost of ceding key ministries to her junior coalition partner, exposing the German chancellor to criticism from her own party.
The SPD leader, Martin Schulz, can be optimistic about rallying support for a new term in government after securing three influential trophy ministries. The draft coalition deal foresees the centre-left party filling the finance, foreign and labour ministries, as well as the roles for family, justice and the environment.
Schulz, who had ruled out playing a role in a Merkel government in the immediate aftermath of last year’s elections, is reportedly planning to hand his party leadership to the former labour minister Andrea Nahles and take charge of the foreign ministry himself.
The SPD mayor of Hamburg, Olaf Scholz, seen as a pragmatic centrist from the party’s liberal wing, is set to succeed the powerful Wolfgang Schäuble in the finance ministry, a key role for the future direction of the eurozone.
The draft coalition agreement hints at a departure from Schäuble’s hawkish focus on balanced budgets, promising a “solidaristic sharing of responsibilities” and a preparedness to increase German contributions to the EU budget.
At a press conference on Wednesday afternoon, Merkel said that divvying up ministries had “not been easy” and acknowledged her party’s disgruntlement at the loss of the finance ministry.
“I’d wager that the SPD didn’t even believe it could get the finance ministry when the negotiations started,” the veteran CDU politician Wolfgang Bosbach told German media on Wednesday. “The CDU should have insisted on keeping the positions it already had.”
A boosted interior ministry with an additional focus on housing construction and life in regional areas has meanwhile reportedly been handed to Horst Seehofer of the Bavaria-based CSU, the Christian Democrats’ sister party – a consistent critic of Merkel’s policy course during the refugee crisis.
Such a constellation would leave Merkel’s own party with only the roles for the economy, defence, health, education and agriculture, and no truly high-profile ministries apart from her own chancellory.
Germany's new cabinet may be made up of the same parties as last year, but it is set to include a minister with a novel new mission: a leaked draft of the coalition deal sees Bavarian politician Horst Seehofer in charge of a ministry responsible for interior affairs, construction... and heimat.
A term without a direct equivalent in English, heimat can refer to one's homeland as well as a broader sense of a place with which one feels a spiritual affinity. Non-German speakers may recognise it from the title of Edgar Reitz's popular art-house soap opera.
Politicians In post-war Germany have traditionally avoided the term for its association with folklore kitsch – until 2013, when the Bavarian CSU set up a “heimat ministry” in Nuremberg, supervised by the state's finance minister.
The Bavarians' motive, it was believed, was to reclaim the language of national belonging from the rightwing populists – a move with limited success.
Bavaria's heimat ministry has so far mainly focused on extending broadband coverage in regional areas. Since Horst Seehofer set up his first heimat ministry, his CSU party has lost ten percentage points in the polls to the far-right AfD.
The coalition deal also complicates the question over who could eventually replace Merkel once she decides to step down. Two politicians recently mooted as potential successors, the young rightwinger Jens Spahn and the more liberal-leaning “mini-Merkel” Annegret Kramp-Karrenbauer, are not expected to play roles in the next government at all.
The CDU and the SPD have been in coalition talks since the first week of January after the collapse of Merkel’s attempt to form an unorthodox “Jamaica” coalition with the pro-business Free Democrats and the Green party.
Deadlocks over employment law and SPD-proposed reforms to the multi-payer health service resulted in the CDU and SPD missing several deadlines they had set themselves.
As the talks ran into Wednesday morning, the chancellor cancelled an official lunchtime meeting with Italy’s prime minister, Paolo Gentiloni.
Once the two parties have officially presented their coalition agreement, the SPD will allow their 460,000 members a vote on whether the party should formally enter a governing coalition with Merkel’s party.
Schulz, whose party has played junior partner to Merkel’s in the government for the past four years, initially ruled out the possibility of another grand coalition under his leadership.
The SPD’s leadership faces opposition from a number of groups, including its own youth wing, the Young Socialists, who believe it should reinvent itself in opposition rather than seek another term in government.
Only SPD members who joined the party before 6pm on Tuesday will be able to vote. At a special party summit in January, only a narrow majority of SPD delegates voted in favour of continuing coalition talks.
At the elections in September, the SPD plunged to its worst result since the second world war, winning just over 20%. And despite emerging as the strongest party, with 33%, the performance of Merkel’s CDU also disappointed supporters.
The Alternative für Deutschland’s role as the largest opposition party is a non-official one but it equips the party with a number of parliamentary privileges.
Migration emerged as a contentious political issue in Germany after 1.2 million people entered the country during the refugee crisis in 2015-16. The backlash against Merkel’s decision to keep open Germany’s borders resulted in a far-right party entering parliament for the first time in more than 50 years."
