"";"url";"date";"title";"body"
"1";"https://www.theguardian.com/uk-news/2018/mar/15/allies-uk-condemn-russia-salisbury-nerve-spy-agent-skripal";2018-03-15;"Allies back UK to condemn Russia over Salisbury nerve agent attack";"Statement by UK, US, Germany and France ramps up rhetoric against Moscow, with Russia expected to retaliate over expulsion of diplomats
International pressure on Russia following the Salisbury nerve agent attack has been strongly ratcheted up, with Britain, the US, France and Germany jointly condemning an “assault on UK sovereignty”, as Washington boosted its own sanctions on Moscow.
With Russia still promising retaliation to the expulsion of 23 of its diplomats from the UK, Theresa May’s frantic telephone diplomacy in the wake of the attack seemed to have coalesced the UK’s allies into a united response.
The joint statement from May, Donald Trump, Emmanuel Macron and Angela Merkel dispensed with any earlier equivocation to say there was “no plausible alternative explanation” for the poisoning of Sergei Skripal and his daughter, Yulia, other than Russian action.
It said the Salisbury attack came amid “a pattern of earlier irresponsible Russian behaviour”. This message was reinforced hours later as the US increased sanctions over Russian interference in the 2016 elections, and accused Russia of a cyber-attack against its energy grid and other infrastructure.
US officials said malware had been found in the operating systems of several organisations and companies in the US energy, nuclear, water and “critical manufacturing” sectors, with the attacks allegedly traced to Moscow.
The statement – described by Downing Street as the first time the leaders of the four nations had spoken together in such a way – marked a toughening of the rhetoric against Moscow, which continued to insist it had nothing to do with the attack.
The leaders said they “abhorred” the Salisbury incident, and the involvement of the Russian-made novichok “constitutes the first offensive use of a nerve agent in Europe since the second world war”.
“It is an assault on UK sovereignty and any such use by a state party is a clear violation of the chemical weapons convention and a breach of international law,” their statement said.
Nerve agents are not hard to make in principle, but in practice it takes specialised facilities and training to mix the substances safely. The raw materials themselves are inexpensive and generally not hard to obtain, but the lethality of the agents means they tend to be manufactured in dedicated labs. The main five nerve agents are tabun, which is the easiest to make, sarin, soman, GF and VX. The latter was used to kill Kim Jong-nam, the half-brother of the North Korean leader, Kim Jong-un, at Kuala Lumpur airport last year. VX is particularly stable and can remain on clothing, furniture and the ground for a long time without proper decontamination.
All pure nerve agents are colourless organophosphorus liquids which, after they were discovered to be highly poisonous in the 1930s, became the dominant chemical weapons of the second world war. Once made, the substances are easy to disperse, highly toxic, and have rapid effects. Most are absorbed swiftly through the skin or inhaled, but they can also be added to food and drink.
The agents take their toll on the body by disrupting electrical signals throughout the nervous system and the effects are fast and dramatic. Victims find it increasingly hard to breathe. Their lungs produce more mucus which can make them cough and foam at the mouth. They sweat, their pupils constrict, and their eyes run. The effects on the digestive system trigger vomiting. Meanwhile the muscles convulse. Many of those affected will wet themselves and lose control of their bowels. At high doses, failure of the nerves and muscles of the respiratory system can kill before other symptoms have time to develop. There are antidotes for nerve agents, such as oxime and atropine, which are particularly effective against VX and sarin, but they should be given soon after exposure to be effective.
The UK had “thoroughly briefed its allies that it was highly likely that Russia was responsible for the attack”, the statement said, adding: “We share the UK assessment that there is no plausible alternative explanation, and note that Russia’s failure to address the legitimate request by the UK government further underlines its responsibility.”
The joint response followed calls between May and the three other leaders in the days since the attack. They included a talk with Macron on Thursday morning, a day after the French president’s spokesman had warned the UK against what he called “fantasy politics”, prompting concerns in No 10 that Macron might hold back on attributing blame.
After the statement was released, Trump told reporters: “It certainly looks like the Russians were behind it. Something that should never, ever happen, and we’re taking it very seriously, as I think are many others.”
May spent some of the Thursday visiting Salisbury, where she met DS Nick Bailey, who became seriously ill after going to the aid of Skripal and his daughter, Yulia.She did not meet the two Russian victims, who remain in a critical condition.
May said the four countries were “very clear in attributing this act to Russia”. The statement showed that “allies are standing alongside us and saying this is part of a pattern of activity that we have seen from Russia,” she said.
Gavin Williamson, the defence secretary, used a speech in Bristol to accuse Russia of “ripping up the international rulebook” through actions aimed at subverting other countries. The Salisbury attack was “atrocious and outrageous,” Williamson said.
Boris Johnson, the foreign secretary, said the evidence against Russia was “overwhelming”. He told the BBC: “There is something in the kind of smug, sarcastic response that we’ve heard that indicates their fundamental guilt. They want to simultaneously deny it, yet at the same time to glory in it.”
While Johnson reiterated Britain’s plan to not send any dignitaries to this summer’s World Cup in Russia, he said the England team should take part.
Johnson said the UK would provide samples of the nerve agent to the Organisation for the Prohibition of Chemical Weapons (OPCW), based at The Hague, for more tests.
Johnson also drew a connection between the Salisbury attack and the Syrian civil war, pointing to the way Russia had repeatedly protected the Assad regime from UN punishment over the Syrian government’s alleged use of chemical weapons. Successive UN inquiries found Assad’s troops had deployed chemical weapons, but the findings were vetoed by Russia.
Writing in the Washington Post, Johnson said: “The common thread that joins the poisonings in Salisbury with the annexation of Crimea, the cyber-attacks in Ukraine, the hacking of Germany’s parliament and Russian interference in foreign elections is the Kremlin’s reckless defiance of essential international rules.”
With Russia expected to expel UK diplomats as part of retaliatory counter-measures, Sergei Ryabkov, Russia’s deputy foreign minister, denied that novichok, the nerve agent identified as used in Salisbury, was of Russian origin.
Along with the cybersecurity alert, the US treasury announced new sanctions against Russian individuals and entities – including the FSB and GRU intelligence agencies – as well as the Internet Research Agency in St Petersburg.
As a result of Russia’s interference in the 2016 presidential election, US officials said that thousands of Russian-planted stories reached millions of people on the internet.
The new sanctions represent the broadest set of US punitive measures against Russia since the start of the Trump administration, and many of their targets are the same as those identified by an indictment by Robert Mueller, the special counsel investigating Russian interference in the 2016 election and possible collusion with the Trump campaign."
"2";"https://www.theguardian.com/world/2018/mar/14/angela-merkel-sworn-in-for-fourth-term-as-german-chancellor";2018-03-14;"Angela Merkel faces multiple challenges in her fourth term";"Close vote before swear-in appears to underline scale of task at home and abroad for new government
Angela Merkel has returned to the German parliament’s governing benches to get to work on an in-tray overflowing with domestic and geopolitical problems after six months of fraught coalition building following September’s federal elections.
Having brought to an end the longest power hiatus in Germany’s postwar history, Merkel has to work with a diminished majority in her fourth term as chancellor to find solutions to immediate challenges, such as the threats from import tariffs from an unpredictable US president and calls for structural reforms to the eurozone’s financial system from France’s president, Emanuel Macron.
In addition, Merkel has to find long-term answers to the rise of the nationalist right, and a debate about growing social inequality in Germany’s booming economy.

Merkel was sworn into office on Wednesday afternoon after receiving 364 out of 709 votes in the first round of voting in parliament – nine more than required to gain an absolute majority, but also 35 fewer than if all the members of her next governing coalition had cast their ballot in her favour.
A look at the main priorities set out in in the German coalition agreement, which will guide policy-making for the next four years.
Europe
Efforts to reform the EU will top the incoming government's agenda as the bloc grapples with rising nationalism, security concerns and an unpredictable US ally in Donald Trump.
As well as agreeing to bolster EU foreign and defence policy, the parties say they are ready to raise Germany's contributions to the EU's budget once Britain leaves. They also support the creation of a European Monetary Fund, but offer only cautious backing for Emmanuel Macron's idea of a eurozone investment budget.
Immigration
Smarting from the backlash over Merkel's decision to open the country's doors to hundreds of thousands of asylum seekers in 2015, the government now aims to cap the annual intake of people seeking safe haven to about 200,000.
At the EU level, Merkel says she continues to expect member states to take in their allocated share of refugees. The chancellor has also reiterated the need to tackle ""the root causes of migration"" with development aid for the countries of origin, while better securing the bloc's outer borders.
Future-proofing economy
Europe's powerhouse economy is booming, with workers enjoying high wages and record-low unemployment, but that has done little to assuage concerns about globalisation and automation in the workplace, as well as growing inequality.
With its flush public coffers, Merkel's government aims to address these fears through investments in infrastructure, an offensive to improve the nation's creaking internet networks, pension reform and more funding for education and life-long learning.
As the chancellor received standing ovations, handshakes and bouquets of flowers from delegates across the political spectrum, she was watched by her 89-year-old mother, Herlind Kasner, seated on the Bundestag’s gallery next to Merkel’s husband, Joachim Sauer, and long-term adviser Beate Baumann.
“A clear vote and a smooth start. Now full steam ahead,” tweeted Annegret Kramp-Karrenbauer, the new general secretary of Merkel’s Christian Democratic Union, which has formed another grand coalition with the Social Democrats (SPD).
Others were less impressed. Wolfgang Kubicki, the deputy leader of the FDP, said of the result of Wednesday’s vote: “That was closer than we expected. It shows that this grand coalition is actually going to be a small coalition.”
Merkel received supporting votes from 91% of delegates in her three-party coalition, compared with 92% in 2013 and 89% at the start of her first term in 2005.
Over the coming years, Merkel will have to find a way to win over unenthusiastic delegates not just among the Social Democrats, many of whom believe the party should have sought to reinvent itself in opposition, but also among the CDU, where there is disappointment over the loss of the finance ministry to the centre-left junior coalition partner.
One CDU politician described the result as a “bad omen” for the coming term. “This coalition has had a bad start, not just because of the unfortunate coalition deal, and won’t last for three and a half years”, said MP Alexander Mitsch.
After the vote, the chancellor travelled to Schloss Bellevue to receive a letter of appointment from the president, Frank-Walter Steinmeier, before heading back to the Bundestag in order to take the oath of office. The new cabinet meets for the first time this afternoon.
The pressure will be on the new government to immediately get down to business, after months of horse-trading and delayed decision-making. Merkel said on Monday her government’s focus would be on integrating refugees as well as increasing state powers to extradite people who had no right of residence. She has also stressed the necessity of securing Germany’s borders and developing policies to mitigate the causes of migration.
The grand coalition was initially seen as an unlikely constellation after the election on 24 September, when Merkel’s conservative alliance, the pro-business Free Democrats and the environmentalist Greens tried to create a so-called “Jamaica” coalition. But after those talks collapsed, both the conservatives and the Social Democrats came under pressure to revive the grand coalition, which has governed Germany for the majority of Merkel’s time in office.
The reformation of the grand coalition means the far-right Alternative für Deutschland becomes the large opposition party in the Bundestag – a non-official role that nonetheless equips the rightwing populists with a number of formal privileges, such as chairing influential parliamentary committees.
On Wednesday, the party already gave a taster of the tactics it may employ to disrupt Merkel and her government over the coming years. One lawmaker, Petr Bystron, was fined €1,000 for tweeting a picture of his secret ballot with the caption “Not my chancellor”, while another was expelled from the visitors’ gallery for holding up a “Merkel has to go” banner.
Even without a noisy nationalist right, the new Bundestag is likely to hear a more robust tone from its members. The coalition deal between the CDU and SPD commits the government to a number of new debating formats, including a triannual Westminster-style “chancellor’s question time”, in which the head of the government has to field questions from the opposition.
When Steinmeier swore in Merkel as chancellor, he appeared to nod to the fact that her fourth term in power could yet prove to be her most challenging: “Let me give you my best wishes on your difficult path,” the former foreign minister said."
"3";"https://www.theguardian.com/world/2018/mar/12/angela-merkel-pledges-grand-coalition-for-the-little-people";2018-03-12;"Germany promised ‘grand coalition for the little people’ in Merkel's fourth term";"CDU signs deal with CSU and SPD as chancellor suggests tougher stance on migration
Germany’s new government has vowed to become a “grand coalition for the little people”, as Angela Merkel’s conservatives and her two coalition partners embark on a precarious project of reforming Europe while nodding to the language and concerns of the far-right.
Merkel, who is due to be sworn in for her fourth term as chancellor on Wednesday, almost six months after national elections last September, said on Monday that her new government would focus on “the integration of refugees, but also on the state’s ability to act when people have not been granted right of residence”.
“We have all enjoyed the benefits of the Schengen area, allowing us to move freely,” Merkel said at a joint press conference with her new vice-chancellor and finance minister, the Social Democrat (SPD) Olaf Scholz, and her interior minister, Horst Seehofer of the Bavarian-based Christian Social Union (CSU).
“But when we introduced free movement, we did not sufficiently think about securing our outer borders. That has to happen now, as well as a development policy that tackles the causes of migration,” she added.
On Sunday, Seehofer laid down his government’s law-and-order credentials by pushing for more video surveillance in public areas and faster deportations of rejected asylum seekers.
Wednesday’s swearing-in of the new government will put an official end to the longest period of coalition-building in Germany’s postwar history.
An aborted attempt to forge an unorthodox “Jamaica” coalition between Merkel’s CDU, the pro-business FDP and the Green party last November resulted in a revival of the “grand coalition” between centre-right and centre-left that has governed the country for the last four years, eventually approved by a vote of the SPD’s membership at the start of this month.
On Monday, Merkel nonetheless insisted that plans to present joint European initiatives with the French president, Emmanuel Macron, in March remained on schedule, in spite of her ponderous path to power.
“I never said anything about a delay,” said Merkel, announcing that she would visit Paris shortly after her inauguration. “We certainly won’t have settled every last question, but we’ll be able to say more than in December. It surely would be too much to expect us to spell out every facet of the eurozone for the next 20 years.”
Merkel said the Franco-German tandem had been galvanised into action by the US president Donald Trump’s plans to introduce 25% tariffs on steel imports.
Referring to the threat of a pending trade war, Scholz said: “In an ever more complex world, it is absolutely necessary that Europeans stick together and develop solutions and methods to take control of shaping their future.”
Scholz, the SPD caretaker leader and a former mayor of Hamburg, signalled that his party would foster more combative relations with its coalition partner, remarking that “the fourth grand coalition in German history did not start out as a love match”. Merkel said she was looking forward to a “good debating culture” within her cabinet.
Both parties go into government on the back of historically poor election results last September, and the SPD’s polling figures have nosedived after its leadership made a U-turn on an announcement to seek renewal in opposition.
Yet Scholz can embark on his new ministerial portfolio with his party on a high after successive polls over the weekend appeared to reward the SPD for going into government. A survey on Sunday by the polling institute Insa saw the far-right Alternative für Deutschland drop into fourth place behind Merkel’s Christian Democratic Union, the SPD and the Green party.
The new government will start with the same constellation of political parties but a reshuffled lineup of personnel. The CDU has ceded control of the finance ministry to the SPD and of the interior ministry to the CSU. Merkel and the defence minister, Ursula von der Leyen, will be the only politicians to retain the roles they held over the last four years."
"4";"https://www.theguardian.com/commentisfree/2018/mar/04/germany-coalition-merkel-macron-europe-eu";2018-03-04;"Germany’s coalition deal safeguards the Merkel/Macron vision of Europe";"Back for a fourth term, the German chancellor faces tensions at home – but her role as head of the EU’s most successful economy is unchallenged
Angela Merkel’s new coalition government is testament to her skill as the great survivor, and to the unwisdom of underestimating her ability to outmanoeuvre opponents. Alliances of Germany’s two main parties are dubbed “elephant coalitions”. The one agreed this morning lumbers into life on very different terms from the last GroKo (grand coalition). “Two tired elephants, dancing for the last time,” was the verdict of one speaker at the recent special conference of the Social Democratic party (SPD), calling for an end to deals with “the Merkelator” and her Christian Democrats.
In the end, she prevailed by a decent margin. There was a two-thirds majority among SPD members for remaining in the coalition, while a third backed a youth-led campaign to shake up left-of-centre politics.
Brexiteers' appeals to Merkel to break the logjam with EU negotiators have not worked
But the difficulty in delivering the coalition (five months since the election) marks a change that will resonate beyond Germany’s borders. It shows the renewed power of party grassroots, and the increasing influence of members over grandees.
For one thing, this deal placed Merkel’s fate squarely in the hands of SPD members (including 20,000 new sign-ups) – a move that has given voice to the left of the party. A two-thirds vote of support for GroKo is fine for Merkel – but much less so for the SPD, digesting poor election results and with a probable new leader, Andrea Nahles. She will need to apply pressure on the new government for a clearer leftish agenda – to prevent the one-third of disappointed SPD members from turning into a Corbyn-inspired movement for sweeping change.
Yet the greatest challenge to business-as-usual comes from another base: Merkel’s Christian Democrat party, from whose restless ranks her successor will emerge. The promotion to party secretary of Annegret Kramp-Karrenbauer, a flinty Christian Democrat from the Saarland in western Germany, marks a departure from years of Merkel-worship and redistributes power in the party from a close-knit pro-Merkel faction in Berlin.
“AKK” this week described dealings with Merkel as a “good, balanced relationship of trust and respect”. It’s a tone that cannily pays its dues to Merkel’s leadership, while putting Kramp-Karrenbauer herself at eye-level with the chancellor, and speaking for members – underlining that they have been taken for granted.
Kramp-Karrenbauer tartly observes that the party’s list of broad policy objectives has barely changed since 2007 – “the year the first iPhone was released”. Lines of dissent with the SPD lurk in her assertion that not enough has been done in Berlin to address the integration of the refugees the chancellor welcomed in large numbers in 2015. And she has pointed out, in language sharper than has been conventional on Team Merkel, that voters are “furious that people coming here for protection and aid have lied about their ages and countries of origin”.
If Merkel has previously swept aside unease on this issue, she must now deal more openly with anxieties about integration and the details of how to deal with irritations and fears that arise from it. She said last Monday that Germany had “no-go areas”, where police and public fear to tread. That frankness, if handled with good sense by the coalition, could keep at bay the far right, which has risen in part because conservative voters felt their concerns went unheard.
It may, in the short term, give Alternative for Germany (AfD) more “told-you-so” ammunition with which to make trouble in its new strengthened role in parliament. The Merkel-led coalition intends to head that off by capping annual refugee numbers at 220,000 (a concession for a chancellor who refused a cap in 2015).
Germany’s good fortune, however, is that a healthy budget surplus means there is money to deal with the difficulties. Its left wing will be happy to get more childcare, and curbs on short-term contracts. And for the right there will be some tax cuts and a more forthright acknowledgment of the difficulties of openness to refugees.
The most troublesome conundrum after all this is that it will be hard to convince the sizeable chunk of voters who drifted to parties of the far left, far right and the Greens last year that one more dance of Germany’s elephants represents a radical shift. The AfD in particular will gain more oxygen as the official opposition party.
For Europe (and Britain approaching Brexit), there will be little change. Merkel signals emphatically in private that she sees the French president, Emmanuel Macron, as sharing her worldview, and will use her remaining time to consolidate that link. Theresa May’s declared “trade-offs” will have to be approved, like it or not, by a renewed Franco-German duopoly. A weakened SPD makes the coalition even more avidly pro-EU. So the new alliance will move faster on European fiscal integration, and seek to edge towards a combined eurozone budget, though at a cautious pace.
None of this is easy listening for May. Her Brexit secretary, David Davis, has pre-emptively been seeking better relations with Team Macron – tacit acceptance by the cabinet’s Brexiteers that appealing to Merkel to break the logjam with EU negotiators has not worked. But it is still Germany, as the EU’s most successful economy, that will remain the biggest influence on what kind of Europe emerges from the continent’s recent convulsions. On that, Merkel is where she aims to be in her final stint at the helm – unchallenged."
